{
  "@context": [
    "https://www.w3.org/ns/credentials/v2",
    "https://schema.org/",
    "https://schema.beckn.io/Location/2.0/context.jsonld",
    "https://schema.beckn.io/ElectricityCredential/v1.1/context.jsonld",
    "https://schema.beckn.io/EnergyResource/v2.0/context.jsonld"
  ],
  "id": "urn:uuid:e5f6a7b8-9012-34ab-cdef-567890123456",
  "type": ["VerifiableCredential", "ElectricityCredential"],
  "issuer": {
    "id": "https://example-utility.com/issuers/energy-dept",
    "name": "Example Energy Utility",
    "idRef": {"issuedBy": "did:web:exreg.gov", "subjectId": "exreg.gov:AABPC00001"}
  },
  "validFrom": "2025-01-13T10:30:00-05:00",
  "validUntil": "2026-01-13T10:30:00-05:00",
  "credentialStatus": {
    "id": "https://dedi.global/dedi/lookup/example-utility.com/vc-revocation-registry/e5f6a7b8-9012-34ab-cdef-567890123456",
    "type": "dediregistry",
    "statusPurpose": "revocation",
    "statusListCredential": "https://dedi.global/dedi/query/example-utility.com/vc-revocation-registry"
  },
  "credentialSubject": {
    "id": "did:example:customer:abc123",
    "customerProfile": {
      "customerNumber": "UTIL-2025-001234567",
      "idRef": {"issuedBy": "did:web:ssa.gov", "subjectId": "ssa.gov:XXX-XX-1234"},
      "energyResources": [
        {
          "id": "DT-FEEDER-A1-001",
          "type": "DT",
          "attributes": {"ratedPowerKw": 250, "feeder": "FEEDER-A1", "bus": "BUS-11kV-001"}
        },
        {
          "id": "MET2025789456123",
          "type": "METER",
          "attributes": {"meterType": "AMI", "gps": "37.7749,-122.4194"},
          "parentResources": ["DT-FEEDER-A1-001"]
        },
        {
          "id": "DER-SOLAR-001",
          "type": "SOLAR",
          "attributes": {"ratedPowerKw": 3, "make": "SunPower Corporation", "model": "SPR-X22-360", "commissioningDate": "2025-01-12"},
          "parentResources": ["MET2025789456123"]
        },
        {
          "id": "DER-WIND-001",
          "type": "WIND",
          "attributes": {"ratedPowerKw": 1.5, "make": "Windmill Co.", "model": "WM-MICRO-150", "commissioningDate": "2025-03-01"},
          "parentResources": ["MET2025789456123"]
        },
        {
          "id": "BESS-001",
          "type": "BATTERY",
          "attributes": {"ratedPowerKw": 5, "energyCapacityKwh": 10, "storageType": "LithiumIon", "commissioningDate": "2025-01-12"},
          "parentResources": ["MET2025789456123"]
        },
        {
          "id": "BESS-002",
          "type": "BATTERY",
          "attributes": {"ratedPowerKw": 2.5, "energyCapacityKwh": 5, "storageType": "LithiumIon", "commissioningDate": "2025-06-01"},
          "parentResources": ["MET2025789456123"]
        }
      ],
      "consumptionProfiles": [
        {
          "meterId": "MET2025789456123",
          "sanctionedLoadKW": 5,
          "tariffCategoryCode": "RES-01",
          "premisesType": "Residential",
          "connectionType": "Single-phase"
        }
      ]
    },
    "customerDetails": {
      "fullName": "Jane Doe",
      "installationAddress": {
        "address": "123 Energy Street, Unit 4",
        "city": {"name": "Metro City", "code": "METRO"},
        "district": "Metro District",
        "state": {"name": "Example State", "code": "EX"},
        "country": {"name": "United States", "code": "US"},
        "area_code": "12345",
        "gps": "37.7749,-122.4194",
        "openLocationCode": "849VCWC8+R9"
      },
      "serviceConnectionDate": "2025-01-10T00:00:00-05:00"
    }
  },
  "proof": {
    "type": "Ed25519Signature2020",
    "created": "2025-01-13T10:30:00-05:00",
    "verificationMethod": "https://example-utility.com/issuers/energy-dept#key-1",
    "proofPurpose": "assertionMethod",
    "proofValue": "z58DAdFfa9SkqZMVPxAQpic7ndTaXoT..."
  }
}
